{
	"$schema": "https://json-schema.org/draft/2020-12/schema",
	"$id": "src/content/skills/skills.schema.json",
	"title": "Skills Page",
	"type": "object",
	"additionalProperties": false,
	"required": ["slug", "title", "columns"],
	"properties": {
		"slug": {
			"type": "string"
		},
		"title": {
			"type": "string"
		},
		"ai": {
			"type": "object",
			"additionalProperties": false,
			"required": ["summary"],
			"properties": {
				"summary": {
					"type": "string"
				},
				"highlights": {
					"type": "array",
					"items": {
						"type": "string"
					}
				},
				"keywords": {
					"type": "array",
					"items": {
						"type": "string"
					}
				},
				"suggestedQuestions": {
					"type": "array",
					"items": {
						"type": "string"
					}
				}
			}
		},
		"columns": {
			"type": "array",
			"minItems": 1,
			"items": {
				"type": "object",
				"additionalProperties": false,
				"required": ["title", "sections"],
				"properties": {
					"title": {
						"type": "string"
					},
					"description": {
						"type": "string"
					},
					"sections": {
						"type": "array",
						"items": {
							"oneOf": [
								{
									"type": "object",
									"additionalProperties": false,
									"required": ["type", "title", "items"],
									"properties": {
										"type": {
											"const": "sliders"
										},
										"title": {
											"type": "string"
										},
										"description": {
											"type": "string"
										},
										"items": {
											"type": "array",
											"items": {
												"type": "object",
												"additionalProperties": false,
												"required": ["name", "value", "level"],
												"properties": {
													"name": {
														"type": "string"
													},
													"value": {
														"type": "number",
														"minimum": 0,
														"maximum": 100
													},
													"level": {
														"type": "string"
													}
												}
											}
										}
									}
								},
								{
									"type": "object",
									"additionalProperties": false,
									"required": ["type", "title", "items"],
									"properties": {
										"type": {
											"const": "chips"
										},
										"title": {
											"type": "string"
										},
										"description": {
											"type": "string"
										},
										"items": {
											"type": "array",
											"items": {
												"type": "string"
											}
										}
									}
								}
							]
						}
					}
				}
			}
		}
	}
}
